{
  "type": "FeatureCollection",
  "timeStamp": "2024-02-24T12:00:00Z",
  "processed_at": "2024-02-24T12:00:03Z",
  "processing_elapsed_s": 3.12,
  "metadata": {
    "total_features": 1,
    "successful_features": 1,
    "failed_features": 0,
    "validation_warnings": 0
  },
  "features": [
    {
      "type": "Feature",
      "id": "building_001",
      "geometry": {
        "type": "Point",
        "coordinates": [
          5.0,
          52.0
        ]
      },
      "properties": {
        "start_time": "2018-01-01T00:00:00Z",
        "end_time": "2018-12-31T23:00:00Z",
        "resolution": "60",
        "resolution_unit": "minutes",
        "buem": {
          "building": {
            "name": "Building 001 \u00b7 Single-family House",
            "building_type": "SFH",
            "construction_period": "04",
            "country": "NL",
            "n_storeys": 2,
            "A_ref": {
              "value": 100.0,
              "unit": "m2"
            },
            "h_room": {
              "value": 2.5,
              "unit": "m"
            },
            "neighbour_status": "B_Alone",
            "attic_condition": "N",
            "cellar_condition": "N",
            "envelope": {
              "elements": [
                {
                  "id": "Wall_1",
                  "name": "North Wall",
                  "type": "wall",
                  "area": {
                    "value": 30.0,
                    "unit": "m2"
                  },
                  "azimuth": {
                    "value": 0.0,
                    "unit": "deg"
                  },
                  "tilt": {
                    "value": 90.0,
                    "unit": "deg"
                  },
                  "U": {
                    "value": 1.6,
                    "unit": "W/(m2K)"
                  },
                  "b_transmission": {
                    "value": 1.0,
                    "unit": "-"
                  }
                },
                {
                  "id": "Wall_2",
                  "type": "wall",
                  "area": {
                    "value": 25.0,
                    "unit": "m2"
                  },
                  "azimuth": {
                    "value": 90.0,
                    "unit": "deg"
                  },
                  "tilt": {
                    "value": 90.0,
                    "unit": "deg"
                  },
                  "U": {
                    "value": 1.4,
                    "unit": "W/(m2K)"
                  },
                  "b_transmission": {
                    "value": 1.0,
                    "unit": "-"
                  }
                },
                {
                  "id": "Wall_3",
                  "type": "wall",
                  "area": {
                    "value": 30.0,
                    "unit": "m2"
                  },
                  "azimuth": {
                    "value": 180.0,
                    "unit": "deg"
                  },
                  "tilt": {
                    "value": 90.0,
                    "unit": "deg"
                  },
                  "U": {
                    "value": 1.6,
                    "unit": "W/(m2K)"
                  },
                  "b_transmission": {
                    "value": 1.0,
                    "unit": "-"
                  }
                },
                {
                  "id": "Wall_4",
                  "type": "wall",
                  "area": {
                    "value": 25.0,
                    "unit": "m2"
                  },
                  "azimuth": {
                    "value": 270.0,
                    "unit": "deg"
                  },
                  "tilt": {
                    "value": 90.0,
                    "unit": "deg"
                  },
                  "U": {
                    "value": 1.6,
                    "unit": "W/(m2K)"
                  },
                  "b_transmission": {
                    "value": 1.0,
                    "unit": "-"
                  }
                },
                {
                  "id": "Roof_1",
                  "type": "roof",
                  "area": {
                    "value": 100.0,
                    "unit": "m2"
                  },
                  "azimuth": {
                    "value": 180.0,
                    "unit": "deg"
                  },
                  "tilt": {
                    "value": 30.0,
                    "unit": "deg"
                  },
                  "U": {
                    "value": 1.2,
                    "unit": "W/(m2K)"
                  }
                },
                {
                  "id": "Floor_1",
                  "type": "floor",
                  "area": {
                    "value": 100.0,
                    "unit": "m2"
                  },
                  "azimuth": {
                    "value": 0.0,
                    "unit": "deg"
                  },
                  "tilt": {
                    "value": 0.0,
                    "unit": "deg"
                  },
                  "U": {
                    "value": 1.5,
                    "unit": "W/(m2K)"
                  },
                  "b_transmission": {
                    "value": 0.8,
                    "unit": "-"
                  }
                },
                {
                  "id": "Win_1",
                  "type": "window",
                  "area": {
                    "value": 6.0,
                    "unit": "m2"
                  },
                  "azimuth": {
                    "value": 0.0,
                    "unit": "deg"
                  },
                  "tilt": {
                    "value": 90.0,
                    "unit": "deg"
                  },
                  "parent_id": "Wall_1",
                  "U": {
                    "value": 2.8,
                    "unit": "W/(m2K)"
                  },
                  "g_gl": {
                    "value": 0.6,
                    "unit": "-"
                  }
                },
                {
                  "id": "Win_2",
                  "type": "window",
                  "area": {
                    "value": 8.0,
                    "unit": "m2"
                  },
                  "azimuth": {
                    "value": 180.0,
                    "unit": "deg"
                  },
                  "tilt": {
                    "value": 90.0,
                    "unit": "deg"
                  },
                  "parent_id": "Wall_3",
                  "U": {
                    "value": 2.8,
                    "unit": "W/(m2K)"
                  },
                  "g_gl": {
                    "value": 0.6,
                    "unit": "-"
                  }
                },
                {
                  "id": "Win_3",
                  "type": "window",
                  "area": {
                    "value": 4.0,
                    "unit": "m2"
                  },
                  "azimuth": {
                    "value": 90.0,
                    "unit": "deg"
                  },
                  "tilt": {
                    "value": 90.0,
                    "unit": "deg"
                  },
                  "parent_id": "Wall_2",
                  "U": {
                    "value": 2.5,
                    "unit": "W/(m2K)"
                  },
                  "g_gl": {
                    "value": 0.6,
                    "unit": "-"
                  }
                },
                {
                  "id": "Door_1",
                  "type": "door",
                  "area": {
                    "value": 2.0,
                    "unit": "m2"
                  },
                  "azimuth": {
                    "value": 0.0,
                    "unit": "deg"
                  },
                  "tilt": {
                    "value": 90.0,
                    "unit": "deg"
                  },
                  "parent_id": "Wall_1",
                  "U": {
                    "value": 3.0,
                    "unit": "W/(m2K)"
                  }
                },
                {
                  "id": "Vent_1",
                  "type": "ventilation",
                  "air_changes": {
                    "value": 0.5,
                    "unit": "1/h"
                  }
                }
              ]
            },
            "thermal": {
              "n_air_infiltration": {
                "value": 0.5,
                "unit": "1/h"
              },
              "n_air_use": {
                "value": 0.4,
                "unit": "1/h"
              },
              "thermal_class": "medium",
              "c_m": {
                "value": 110.0,
                "unit": "kJ/(m2K)"
              },
              "comfortT_lb": {
                "value": 21.0,
                "unit": "degC"
              },
              "comfortT_ub": {
                "value": 24.0,
                "unit": "degC"
              },
              "F_sh_hor": {
                "value": 0.7,
                "unit": "-"
              },
              "F_sh_vert": {
                "value": 0.75,
                "unit": "-"
              },
              "F_f": {
                "value": 0.2,
                "unit": "-"
              },
              "F_w": {
                "value": 0.9,
                "unit": "-"
              },
              "phi_int": {
                "value": 3.0,
                "unit": "W/m2"
              },
              "q_w_nd": {
                "value": 12.5,
                "unit": "kWh/(m2.a)"
              }
            }
          },
          "solver": {
            "use_milp": false,
            "compute_cooling": true,
            "parallel_thermal": true,
            "use_chunked_processing": true
          },
          "inputs": {
            "electricity_load_profile": {